{
  "$schema": "https://json-schema.org/draft/2020-12/schema",
  "$id": "https://awesome-claws.local/schemas/event-sponsorship-coordinator-handoff.schema.json",
  "title": "Event sponsorship coordinator structured handoff",
  "type": "object",
  "additionalProperties": false,
  "required": [
    "schemaVersion",
    "claw",
    "request",
    "scope",
    "evidence",
    "blockers",
    "ownerActions",
    "prohibitedActions",
    "readyState",
    "nextOwner",
    "generatedAt"
  ],
  "properties": {
    "schemaVersion": {
      "const": "awesomeClaws.x3Handoff.v1"
    },
    "claw": {
      "const": "event-sponsorship-coordinator"
    },
    "request": {
      "type": "string",
      "minLength": 1
    },
    "scope": {
      "type": "string",
      "minLength": 1
    },
    "evidence": {
      "type": "array",
      "minItems": 1,
      "items": {
        "type": "object",
        "additionalProperties": false,
        "required": [
          "id",
          "title",
          "source",
          "status",
          "summary"
        ],
        "properties": {
          "id": {
            "type": "string",
            "pattern": "^[a-z][a-z0-9-]{2,63}$"
          },
          "title": {
            "type": "string",
            "minLength": 1
          },
          "source": {
            "type": "string",
            "minLength": 1
          },
          "status": {
            "enum": [
              "current",
              "stale",
              "missing",
              "conflicting",
              "blocked"
            ]
          },
          "summary": {
            "type": "string",
            "minLength": 1
          }
        }
      }
    },
    "blockers": {
      "type": "array",
      "minItems": 1,
      "items": {
        "type": "object",
        "additionalProperties": false,
        "required": [
          "id",
          "owner",
          "reason"
        ],
        "properties": {
          "id": {
            "type": "string",
            "pattern": "^[a-z][a-z0-9-]{2,63}$"
          },
          "owner": {
            "type": "string",
            "minLength": 1
          },
          "reason": {
            "type": "string",
            "minLength": 1
          }
        }
      }
    },
    "ownerActions": {
      "type": "array",
      "minItems": 1,
      "items": {
        "type": "object",
        "additionalProperties": false,
        "required": [
          "id",
          "owner",
          "action"
        ],
        "properties": {
          "id": {
            "type": "string",
            "pattern": "^[a-z][a-z0-9-]{2,63}$"
          },
          "owner": {
            "type": "string",
            "minLength": 1
          },
          "action": {
            "type": "string",
            "minLength": 1
          }
        }
      }
    },
    "prohibitedActions": {
      "type": "array",
      "minItems": 2,
      "items": {
        "type": "string",
        "minLength": 1
      }
    },
    "readyState": {
      "enum": [
        "blocked",
        "review-ready"
      ]
    },
    "nextOwner": {
      "type": "string",
      "minLength": 1
    },
    "generatedAt": {
      "type": "string",
      "format": "date-time"
    }
  }
}
